{
  "adjudication_count": 0,
  "baseline_model_runs_started": false,
  "benchmark_evidence_claimed": false,
  "board_admitted_count": 0,
  "board_id": "adds-frontier-private-pilot-v1",
  "compiled_on": "2026-08-22",
  "consensus_candidate_count": 0,
  "consensus_rule": "three_independent_exact_responses",
  "human_review_required": true,
  "independent_review_complete": false,
  "integrity_sha256": "a8f224f1673a5012ee6321fae98eabfe7388a9a9a1c750ec88149e16e7b8403a",
  "nonclaims": [
    "Consensus candidates cannot pass board gates without the frozen human and replay process.",
    "No private packet, key, response, reviewer, affiliation, or adjudication bytes are public.",
    "No reviewer assignment, response, consensus, board admission, model run, or benchmark result is claimed.",
    "Pairwise causal consistency is necessary but does not establish scientific correctness.",
    "Synthetic state-machine tests are not live review evidence.",
    "Workflow readiness is not a reviewer response or scientific judgment."
  ],
  "packet_count": 20,
  "pair_consistency_rule": "pair_assessment_equals_observed_stage_deltas",
  "pairwise_causal_consistency_ready": true,
  "pre_access_invariance_ready": true,
  "pre_access_invariance_rule": "bounded_evidence_arms_invariant_before_access_delta",
  "private_ledger_commitment": "58dfe80f2ad02a77ff7ad9dc00b020533f7cd8d637a8756486f6258e039c8267",
  "private_payload_published": false,
  "protocol_id": "adds-frontier-v1",
  "required_response_count_per_packet": 3,
  "response_contract_ready": true,
  "reviewer_assignment_count": 0,
  "reviewer_response_count": 0,
  "routing_precedence": [
    "adjudication_required_abstention",
    "adjudication_required_action_disagreement",
    "adjudication_required_support_disagreement",
    "adjudication_required_change_disagreement",
    "consensus_candidate"
  ],
  "schema_version": "adds.frontier-semantic-review-workflow-summary.v1",
  "semantic_readiness_integrity_sha256": "77820aee164f603655ef23a3454feb05e3976e43f9a7ba6beba974daeea5f486",
  "status": "workflow_contract_ready_no_reviews",
  "triage_state_machine_ready": true,
  "unassigned_packet_count": 20,
  "workflow_id": "adds-frontier-semantic-review-workflow-v1"
}
